{"backups":{"max_bytes":10485760,"max_days":30,"max_records":5},"generation_retention":"unbounded","limit_policy_version":"1.0","minimum_reader_version":"0.2.0","policy_version":"1.0","private_recovery":{"max_bytes":33554432,"max_records":16,"warning_hours":24},"record_digest":"6fd1b84b02d736124337c3e50a57ac2ec8d7efad4f1cd74e78e29b3f8e53d327","schema_digest":"f7b9245cb10205b7bb1eb21c95abfb241d79aeb86f2ad90be2dfc0e5e9d9bf50","schema_version":"1.0","writer_version":"0.2.0"}
